id,name,image,category,ingredients,instructions,createdAt,updatedAt
56844b73-5d69-437c-91a4-7de082370705,Hawaii Kalbi,kalbi1.jpg,["Dinner","Meats"],["3 lbs Kalbi short rib of beef","1 cup shoyu","1/2 cup Brown sugar","1 cup water","1 inches Fresh ginger","8-9 clove Garlic, minced","2 Tbsp Sesame oil","1/4 cup mirin","1/4 cup Rice wine","1 tsp Black pepper","6 Green onions","1 Finely grated asian pear","1 Finely grated kiwi","Toasted sesame seeds for garnishing"],1. Rinse beef ribs to remove bone fragments and set aside.  2. Mix water, shoyu, brown sugar, mirin, rice wine, sesame oil, black pepper, ginger, green onions, grated pear, grated kiwi, and garlic in a large bowl or blender.  3. Put meat in a container or ziploc bag and add marinade to cover. Seal and refrigerate overnight or up to 3 nights.  4. Broil meat on high until desired doneness is reached.,2023-02-17T03:00:05.755Z,2023-02-17T03:00:05.755Z
f23adad0-f645-4b0f-9d85-579a85b32471,Mochiko chicken,mochiko_chicken.jpg,["Dinner","Meats"],["3 lbs chicken","4 tbsp flour","3 tbsp sugar","2 tbsp Chopped green onion","1 clove Chopped garlic","8 tbsp cornstarch","4 tbsp shoyu","1 tsp salt","2 eggs"],1. Marinate the chicken by combining it with sugar, green onion, garlic, shoyu and salt in a container or ziploc bag. Let it marinate in the fridge overnight.  2. In a bowl, mix flour, cornstarch, and eggs until the mixture has a batter-like consistency.  3. Cut the chicken into bite-sized pieces and dip them into the batter.  4. Transfer the chicken pieces immediately to hot oil.  5. Fry the chicken until brown.,2023-02-17T03:00:53.667Z,2023-02-17T03:03:14.535Z
b46474e6-8c22-4e55-bd00-f1db9726b254,Rafute (Okinawan braised pork belly),rafute2.jpg,["Dinner","Meats"],["3 lbs Pork belly, boneless, skin on","6 cups water","3 cups Katsuobushi (dried bonito flakes) or Hondashi soup stock","1.5 cups awamori(okinawan distilled liquor, substitute with sake or vodka)","0.75 cups Black sugar(substitute with muscovado sugar)","1/2 cup Soy sauce (8 tbsp, divided)","1.5 knob ginger'"],1. Wash the pork belly.  2. Place the pork belly in a large pot and add cold water. Bring to a boil and boil for 1 minute, then discard the water.  3. Rinse off any scum and foam from the pork, rinse the pot, and place the pork belly back in the pot. Fill it with cold water.  4. Bring the pot to a boil, skim off any scum and foam, and reduce the heat to a simmer. Cook the pork uncovered for at least 1 to 1.5 hours. Add boiling water as needed to keep the pork fully covered.  5. In a separate smaller pot, boil 4 cups of water. Add katsuobushi and let it simmer for 15 seconds. Turn off the heat and let the katsuobushi seep in the pot. Alternatively, you can use Hondashi soup stock to make the broth.  6. Slice the ginger and cut it into thin strips. Soak them in water for 10-15 minutes to remove some spiciness. Drain well and set aside for garnishing later.  7. After 1 to 1.5 hours of cooking the pork belly, transfer it to a plate and cover it with foil. Let it cool for about 5 minutes before slicing.  8. Once the pork belly is cool enough to handle, slice it to the desired thickness and add it back to the pot.  9. Strain the katsuobushi dashi into the pot with the pork belly.  10. Add awamori, black sugar, and soy sauce to the pot, mixing the liquid to make sure the pork belly is fully covered with the sauce.  11. Bring the pot to a gentle simmer, skim off any foam, and cover with a lid. Cook over medium-low heat for 2 hours, or until the pork is very tender and the skin/fat is gelatinous.  12. Serve the pork belly on a plate and pour some of the braising liquid over it. Garnish with the ginger slices.,2023-02-17T04:01:00.464Z,2023-02-17T04:01:00.464Z
8f8ac7ed-29c6-41b3-89b0-611f833a2138,Rotisserie Ham,null,["Dinner","Meats"],["7-9 lb Turkey","1 Can (20oz) Pineapple, undrained","1 cup Brown sugar","1/4 tsp Ground cloves","1 tbsp Dijon mustard","1 tbsp Salted butter"],1. Bring pineapples, mustard and sugar to a boil.  2. Lower heat to medium, reduce by ⅓ about 4 to 6 minutes.  3. Remove from heat. Stir in butter.  4. Brush ham. Keep brushing while cooking.  5. Ham needs to reach 140f internal temp at the thickest part.,2023-02-17T04:01:23.637Z,2023-02-17T04:02:51.768Z
e51a3a0b-c4bd-4c67-8cf1-429fa7c94660,Turkey Meatballs,null,["Dinner","Meats"],["2 lb Ground turkey","1 cup panko","2/3 cup Onion, minced","1/2 cup Fresh parsley","2 large eggs","3 cloves garlic","2 tsp Worcestershire sauce","1/2 tsp Dried basil","1/2 tsp Dried oregano","Salt and pepper","1/4 cup Olive oil"],1. Dice the onion and mince the garlic.  2. In a mixing bowl, combine ground turkey, Worcestershire sauce, eggs, onion, and garlic.  3. Add the dried spices to the turkey mixture and mix well.  4. Mix the panko breadcrumbs into the mixture last.  5. Form the mixture into meatballs.  6. Preheat the oven to 400 degrees Fahrenheit.  7. Place the meatballs on a baking sheet or rack and bake for about 12 minutes or until desired browning is achieved.,2023-02-17T04:20:54.822Z,2023-02-17T04:20:54.822Z
c2d8016a-2f1d-4463-9fc1-4f5dffc0aaa4,Korokke,korokke1.jpg,["Dinner","Meats"],["2 lb Russet potatoes (about 4 potatoes)","1 onion","1/2 carrot","2 Shiitake mushrooms","2 Tbsp oil","1 lb Ground beef","1 large Egg (50g w/o shell)","1 tsp salt","1/4 tsp White pepper powder","1/2 cup All-purpose flour","3 large eggs","2 cups panko","Tonkatsu sauce (for serving)"],To Make Korokke Patties  1. Peel and cut potatoes into quarters, boil until soft, drain, and lightly mash.  2. Finely chop onion, carrot, and shiitake mushrooms and sauté in a skillet until soft.  3. Add cooked meat, salt, white pepper, and black pepper to the skillet, cook until done, and drain.  4. Mix the mashed potatoes and drained mixture together, add an egg, and combine.  5. Shape the mixture into patties and refrigerate for 30 minutes to prevent them from exploding while frying.  6. After 30 minutes, coat each patty with flour, egg, and panko, in that order.  7. Cover with plastic and refrigerate for 30 minutes.  8. Deep fry Korokke until they are golden brown. The inside is already cooked, so all you need to do is to fry them until nicely brown.,2023-02-17T04:23:41.285Z,2023-02-17T04:23:41.285Z
60898e2c-bdc5-4915-b9fb-9ddc357f72cc,Butter Chicken,null,["Dinner","Meats"],["1 Tbsp oil","1 Tbsp butter","1 medium Onion, diced","1 tsp ginger","2-3 cloves garlic","1-1/2 lbs Boneless chicken breast, cut into ¾ inch chunks","4 Tbsp Tomato paste (or 8oz can tomato sauce)","1 Tbsp Garam masala","1 tsp Chili powder (or paprika)","1 tsp Fenugreek","1 tsp cumin","1 tsp salt","1/4 tsp Black pepper","1 cup Heavy cream"],1. Heat large skillet over medium-high heat. Add oil, butter, and onions until golden, about 3-4 minutes. Add ginger and garlic and let cook for 30 seconds. Stir so it doesn’t burn.  2. Add chicken, tomato paste, and spices. Cook for 5-6 minutes or until everything is cooked.  3. Add heavy cream and simmer for 8-10 minutes, stirring occasionally. Serve over rice.,2023-02-17T04:26:37.692Z,2023-02-17T04:26:37.692Z
9a12492b-daf3-4e5e-a75b-0cf8080983d9,Buttermilk Fried Chicken Tenders,buttermilk_chicken_tenders.jpg,["Dinner","Meats"],["1 lbs chicken","1/2 cup buttermilk","1/2 cup panko","1/2 cup All-purpose flour","1/4 tsp Baking powder","1 tsp salt","1/4 tsp Black pepper","1 tsp paprika","1/4 tsp Garlic powder","3 Tbsp Melted butter, or oil spray"],1. Place chicken in a ziplock bag and pour the buttermilk into the bag. Squeeze air out and seal the bag. Let marinate in the fridge for 15-30 minutes.  2. In a shallow bowl combine the panko, flour, baking powder, and spices.  3. Remove the chicken strips from the buttermilk with a fork, shake off excess buttermilk, and dredge in the breadcrumb mixture to coat on all sides.  4. Preheat the air fryer to 350 F if necessary.  5. Put the chicken in the air fryer and air fry for 10-12 minutes, cook until the internal temperature reads 175F and the chicken tenders are golden brown and crispy.  6. **Bonus** pause after 4 minutes and brush chicken with melted butter then turn it over and brush butter on the other side.  7. Serve with your favorite dipping sauce.,2023-02-17T04:28:25.066Z,2023-02-17T04:28:25.066Z
0daf4975-7b6e-4afc-a634-fe65e8a86e43,Meat Jun,meatjun1.jpg,["Dinner","Meats"],["3/4 cup shoyu","1/2 cup water","3/4 cup sugar","2 cloves Minced garlic","1/3 cup shoyu","1 Tbsp Rice wine vinegar","1 tsp Sesame oil","1 tsp gochujang/chili oil","1 lbs Thinly sliced beef","8 eggs","Flour, as needed"],1. In a mixing bowl, combine the first four ingredients and mix well until sugar has dissolved.  2. Add meat to the marinade and cover with a plastic wrap or towel. Let it marinate in the fridge for 1-2 hours.  3. After the meat has marinated, whisk eggs in a large bowl.  4. Add enough flour to a plate to dredge the meat in.  5. Heat and oil a non-stick pan over medium heat.  6. Dredge the meat first in flour, then cover it in the whisked eggs.  7. Quickly transfer the meat to the pan.  8. Repeat the same process until the pan is slightly full.  9. Cook the meat for 1-2 minutes or until the bottom becomes lightly golden brown.  10. Flip and cook for another 1-2 minutes.  11. Remove the meat from the pan after all sides have been cooked.  12. For the dipping sauce, combine the remaining shoyu, rice vinegar, sesame oil, and gochujang or chili oil. Whisk to combine.  13. Cut the meat into thin strips and serve with dipping sauce on the side.  14. If you make a large batch, you can freeze it for up to one month.,2023-02-17T04:30:04.130Z,2023-02-17T04:30:04.130Z
9fb0bf7c-5feb-4e08-b9b7-603a22a86264,Loco Moco,locomoco1.jpg,["Dinner","Meats"],["1 onion","1 lb Ground beef","Black pepper, to taste","2 tsp Garlic powder","1/2 cup panko","2 Button mushrooms, sliced","Loco moco gravy","4 eggs"],1. Chop the onion into small pieces.  2. In a mixing bowl, combine the chopped onion with the ground beef.  3. Add black pepper, garlic powder, and panko to the ground beef and mix thoroughly.  4. Knead the meat mixture to ensure that all ingredients are well combined.  5. Shape the meat mixture into about 5 patties of equal size.  6. Heat a frying pan over medium-high heat.  7. Fry the patties in the frying pan until they are browned on both sides, adding sliced mushrooms halfway through the cooking time.  8. In a separate pan, sauté the remaining chopped onion until softened and lightly browned.  9. Make the loco moco gravy using your preferred recipe or mix.  10. Fry the eggs over easy in a separate pan.  11. To serve, place one cooked patty on a plate, then top with sautéed onions and a fried egg.  12. Pour the loco moco gravy over the egg and patty.  13. Repeat with the remaining patties, eggs, onions, and gravy as desired.,2023-02-17T04:31:43.442Z,2023-02-17T04:31:43.442Z
6b3a831f-47d2-4480-8174-a778548932e2,Spam Cabbage,null,["Stews"],["1 head Napa cabbage","1-2 can spam","1/2 cup shoyu","1/4 cup water","4-5 cloves garlic","Pepper (enough to make lots of black spots)","1-2 onions","Oyster sauce"],1. Fry spam in a large pan until crispy.  2. Add garlic to the pan and continue frying until crispy.  3. Add cabbage, shoyu, onion, pepper, water, and oyster sauce to the pan.  4. Bring the mixture to a boil and continue cooking until the cabbage is tender.  5. If desired, mix in more oyster sauce before serving.,2023-02-17T04:33:23.410Z,2023-02-17T04:33:23.410Z
44310c7c-6f33-4564-a682-e244ffe1130b,Kalua Pig Cabbage,kaluapigcabbage1.jpg,["Stews"],["1 head Napa cabbage","1 package May’s Kalua Brand Pork","1/2 cup shoyu","1/4 cup water","4-5 cloves garlic","Pepper (enough to make lots of black spots)","1-2 onions","Red chili pepper flakes"],1. Brown the Kalua Pork, and cook with onions until onions are glossy  2. Add cabbage, shoyu, pepper, water, and garlic. Boil until the cabbage is soft.  3. Add red chili pepper flakes to taste.,2023-02-17T04:40:06.410Z,2023-02-17T04:40:06.410Z
5e68c5f2-214f-4595-a3bc-a7a5b221b6aa,Grandma’s Japanese Mabo Tofu,mabotofu.jpg,["Stews"],["3 Tbsp Minced garlic","1 Tbsp Hot bean paste","1 Tbsp Oyster sauce","1 Tbsp mirin","2 Tbsp shoyu","1 Tbsp Sesame oil","1 cup Chicken stock or water (1 tsp paste)","2 Tbsp Corn starch","2 Tbsp Minced ginger (1 tsp powder)","2 block Tofu (20 oz or less)","1 lb Ground beef"],1. In a mixing bowl, combine all ingredients except for the tofu and ground beef.  2. Brown the ground beef in a separate pan.  3. Add the sauce mixture to the ground beef and simmer in a pot over medium heat.  4. Rinse the tofu and add it to the pot with the ground beef and sauce mixture.  5. Stir the mixture to break up the tofu into smaller pieces.  6. Add chicken stock or water as needed to adjust the consistency of the mixture.  7. Season with salt to taste.  8. Continue to simmer the mixture over low heat until the tofu has absorbed the flavors of the sauce and the mixture is heated through.  9. Serve hot over rice or with your desired side dishes.,2023-02-17T04:43:02.427Z,2023-02-17T04:43:02.427Z
9bd18d74-dbb7-46a4-84b1-298280c598f0,Zippy’s Copycat Chili,null,["Stews"],["1 lb Ground beef","5 oz Pochos (portuguese sausage mild)","1 Medium onion, chopped","4 Medium stalks celery, chopped","1 Green bell pepper, chopped","3 Tbsp Chili powder","1 Tbsp cumin","1 Tbsp oregano","4 cloves Garlic, minced","1 Tbsp Worcestershire sauce","6 oz Tomato paste","1 can Pinto beans, drained","1 can Kidney beans, drained","14 oz Chicken broth","2 leaves Bay","3 Tbsp mayo","1 tsp salt"],1. Blend the pochos sausage in a food processor until it matches the consistency of ground meat.  2. Dice the onion, celery, and bell pepper into small pieces.  3. In a large pot or Dutch oven, heat a little bit of oil over medium-high heat and sauté the diced onion, celery, and bell pepper until soft.  4. Add the ground beef and pochos sausage to the pot and cook until just browned, breaking up any large chunks of meat with a wooden spoon or spatula.  5. Add chili powder, cumin, oregano, and garlic to the pot and sauté until fragrant, stirring constantly.  6. Stir in the tomato paste, chicken broth, drained beans, Worcestershire sauce, and bay leaves. Give everything a good stir.  7. Cover the pot and bring the mixture to a simmer over low heat.  8. Let the mixture cook for at least 30 minutes, stirring occasionally.  9. Remove the bay leaves from the pot.  10. Serve hot with your desired toppings, such as grated cheese, sour cream, or chopped fresh cilantro.,2023-02-17T04:44:52.061Z,2023-02-17T04:44:52.061Z
f1a9f2dc-44e5-4e26-bc7b-5c42071cc9ed,Da Bes Hawaiian Beef Stew,null,["Stews"],["2 lbs Boneless chuck roast","1 medium Onion, chopped","2 Tbsp Tomato paste","3 Tbsp flour","1 bay leaf","3 medium Carrots, peeled and chopped","2 medium Potatoes, peeled and chopped","4 stalks Celery, chopped","15 oz Canned stewed tomatoes","15 oz Canned tomato sauce","2 Tbsp oil","Salt and pepper to tast"],1. Heat oil in a large pot over medium-high heat.  2. Working in small batches in a single layer, brown the beef in the pot, making sure each piece is thoroughly caramelized. When all the meat is brown, set it aside in a bowl.  3. In the same pot, add the chopped onion and brown it for about 3 minutes.  4. Add the tomato paste to the pot and cook for 1 minute.  5. Add the flour to the pot and cook for 1 minute, stirring constantly.  6. Add the 2 pounds of browned beef back into the pot, and season to taste with salt and coarse ground black pepper.  7. Add a bay leaf to the pot.  8. Add enough water so that the browned beef is just covered.  9. Bring the mixture to a boil, then turn the heat down to medium-low and simmer covered for 2 hours.  10. Add the carrots, potatoes, celery, diced tomato, and tomato sauce to the pot and continue to simmer until the vegetables are tender.  11. Finish with some fresh cracked black pepper.  12. Serve hot with rice and/or poi.,2023-02-17T04:47:07.898Z,2023-02-17T04:47:07.898Z
1f76f699-d7ec-4ec2-89eb-ea3bf513c146,Beef Stew with Red Wine,null,["Stews"],["1 1/2 tsp Sea salt","1 tsp Dried crushed rosemary","1 tsp Dried thyme","1 tsp Dried marjoram","1 tsp paprika","1/2 tsp Black pepper","2 Tbsp Vegetable oil","2 lbs Beef stew meat","1 cup Diced white or yellow onion","2 Stalks Celery, chopped","1 tsp Minced garlic","3 Tbsp Tomato paste","1 cup Medium to full-bodied red wine (Cabernet, Zinfandel, or Merlot)","2 cups Beef broth","1 Tbsp Worcestershire sauce","1 bay leaf","1 lb Baby yellow or red potatoes, halved and quartered","3-4 Carrots, peeled and roughly chopped","1 cup Frozen peas, no need to thaw","1/4 cup Fresh Italian parsley","1/4 cup water","2 Tbsp cornstarch"],1. Cut any large pieces of stew meat into smaller bite-size pieces, if necessary.  2. Combine the salt, rosemary, thyme, marjoram, paprika, and black pepper in a small bowl.  3. Heat the oil in a large thick pot over medium-high heat.  4. Add about half of the meat to the pan, or as much as you can without overcrowding.  5. Sprinkle 2 teaspoons of the spice mixture over the meat and sauté the beef until nicely browned.  6. Use a slotted spoon to transfer the beef to a dish and set aside.  7. Repeat with the remaining beef, adding additional oil if needed, and season with 2 more teaspoons of the spice mixture.  8. Reserve remaining spice mixture for later.  9. Add additional oil to the pan if needed and add the onion, celery, and garlic. Cook, stirring occasionally, until softened.  10. Add the tomato paste and stir until well combined.  11. Add the red wine and increase the heat to bring mixture to a boil.  12. Add the beef broth, Worcestershire sauce, remaining spice mix, and the bay leaf.  13. Add the beef and all the juices that have accumulated back to the pot and bring to a boil.  14. Reduce heat to LOW, cover, and simmer for 1.5 hours, or until the beef is fork tender.  15. Add the potatoes and carrots and raise the heat to bring the liquid to a boil.  16. Reduce the heat to LOW, cover, and simmer for another 30 to 40 minutes until the veggies are fork tender.  17. Stir in the frozen peas and parsley.  18. Combine the water and cornstarch in a measuring cup or small bowl and stir into the beef stew.  19. Continue cooking uncovered, until thickened.  20. Discard the bay leaf before serving.,2023-02-17T04:50:44.535Z,2023-02-17T04:50:44.535Z
298b6d9b-3073-4d08-a50d-671213831965,Three Cheese Eggplant Lasagna,null,["Pasta"],["2 eggplants","1 Tbsp Olive oil","1 lb Ground beef","1/2 cup Onion, diced","2 tsp Garlic, minced","24 oz Ricotta cheese","1/2 tsp Italian seasoning","1 egg","1/2 cup Grated parmesan cheese","2 cups Mozzarella balls","1 Tbsp parsley","Salt and pepper to taste"],1. Preheat your oven to 375°F and spray a sheet pan with cooking spray.  2. Cut the eggplants into 1/2-inch slices and brush 2 teaspoons of olive oil over the slices. Season with salt and pepper.  3. Roast the eggplant slices in the oven for 15-20 minutes until tender and browned. If there is any excess moisture on the cooked eggplant, blot it dry with a paper towel.  4. While the eggplant is roasting, prepare the sauce by heating olive oil in a large pan over medium heat.  5. Add ground beef to the pan and season with salt and pepper to taste. Cook for 5-6 minutes, breaking the meat up with a spatula until browned and cooked through.  6. Add onion to the pan and cook for another 3-4 minutes until softened. Add garlic and cook for 30 seconds.  7. Stir in marinara sauce and bring to a simmer. Cook for 5 minutes.  8. In a separate bowl, combine ricotta cheese, Italian seasoning, egg, parmesan cheese, salt and pepper.  9. Coat a 2 or 3 quart baking dish with cooking spray.  10. Place 1/4 of the sauce in the bottom of the dish. Add 1/3 of the eggplant slices on top. Spread 1/3 of the ricotta mixture over the eggplant then top with 1/3 of the mozzarella cheese. Repeat the layers, ending with the mozzarella cheese.  11. Cover and bake for 30 minutes. Uncover and bake for an additional 10 minutes.  12. Sprinkle with parsley, then let stand for 7-10 minutes. Cut into slices and serve.,2023-02-17T04:53:18.121Z,2023-02-17T04:53:18.121Z
13f0e403-ea59-4c88-9749-4ed1682e143f,Fettuccine alfredo,null,["Pasta"],["1 lb Fettuccine pasta","4-6 tbsp butter","3 cloves Garlic (minced)","1.5 cup Heavy cream","1/4 tsp salt","1.25 cup Shredded parmesan","1/4 tsp pepper","2 tbsp parsley"],1. Cook pasta according to package instructions. Reserve 1/2 cup of the pasta water before draining.  2. In a large pan, melt butter over medium heat. Add garlic and cook for 1-2 minutes until fragrant.  3. Pour heavy cream into the pan and stir to combine with the garlic and butter.  4. Allow the cream to reduce for 5-8 minutes, stirring occasionally.  5. Add half of the grated Parmesan cheese to the pan and whisk until melted and well combined.  6. Add the cooked pasta to the sauce and toss to coat the pasta evenly.  7. Add the remaining Parmesan cheese to the pan and stir to combine.  8. If the sauce is too thick, gradually add the reserved pasta water, 1 tablespoon at a time, until the desired consistency is reached.  9. Serve immediately, garnished with additional grated Parmesan cheese and chopped parsley, if desired.,2023-02-17T04:55:08.884Z,2023-02-17T04:55:08.884Z
e8d789ff-7504-4d54-82d4-7ea29cf18066,Spaghetti Sauce,null,[],["1 lb Ground beef","Salt and black pepper, to taste","1 medium Onion, chopped","15 oz Tomato sauce","6 oz Tomato paste","1/2 tsp Italian seasoning","1 Tbsp Dried parsley flakes","1 tsp Garlic powder","Crushed red pepper flakes, to taste","1 Tbsp Worcestershire sauce","1 Tbsp Granulated sugar","1 cup water","1/4 cup Fresh basil leaves (optional)","Spaghetti noodles, for serving"],1. Season ground beef with salt and pepper.  2. In a large skillet, brown the beef over medium-high heat. Drain excess grease.  3. Add chopped onion to the skillet and saute until the onion is soft and translucent.  4. Add tomato sauce, tomato paste, Italian seasoning, parsley, garlic powder, crushed red pepper, Worcestershire sauce, and sugar to the skillet.  5. Stir well to combine all ingredients and bring to a boil.  6. Add water and stir well.  7. Reduce heat to low and let the sauce simmer for 30 minutes, stirring occasionally.  8. Add chopped basil to the sauce before serving, if desired.,2023-02-17T04:56:57.261Z,2023-02-17T04:56:57.261Z
707e1882-fa75-4d88-85b3-0ab86b5e7332,Stuffed Shells with Ricotta & Spinach,null,["Pasta"],["1 lb Baby spinach","500 gram Conchiglioni pasta","12 oz Ricotta cheese","5 oz Pistachio pesto","Garlic","25.5 oz Marinara sauce","0.25 oz Basil","2 oz Grated parmesan cheese","Salt and pepper","Olive oil","Chile flakes (optional)"],1. Bring a pot of salted water to boil.  2. Add spinach and cook until just wilted, 30 seconds to 1 minute. Use a slotted spoon to transfer spinach to colander to drain and cool slightly. (Keep water boiling).  3. Place drained spinach leaves in a kitchen towel and wring out any excess liquid.  4. Add pasta to the pot of boiling water and cook until al dente, 10 minutes or 1 minute less than package instructions. Drain and rinse with cold water.  5. In a large bowl, combine the ricotta with the pesto. Season to taste with salt and pepper.  6. Roughly chop wilted spinach, and add to the mixture, stirring until combined.  7. Chop 3 cloves of garlic. In a large skillet over medium-high heat, warm 2 tablespoons olive oil. When oil is hot, add garlic and cook until fragrant, 30 seconds to 1 minute.  8. Add marinara sauce and pinch of chile flakes. Bring sauce to a simmer, and cook until the flavors combine, 6 minutes. Season to taste with salt.  9. Stuff each shell with 1 tablespoon of filling.  10. Nestle the filled shells into the marinara sauce.  11. Cover and simmer until the shells are warmed through, 5 minutes.  12. Pick the basil, discard the stems, and tear the leaves.  13. Spoon the shells into shallow bowls, sprinkle with Parmesan and torn basil leaves, and serve warm.,2023-02-17T08:47:04.853Z,2023-02-17T08:47:04.853Z
f20d7aa0-fa0d-418b-aa4e-7f9e84e9b1e0,Homemade Cheeseburger Macaroni,null,["Pasta"],["1 lb Ground beef","1 Tbsp oil","1 small Onion, finely chopped","3 Tbsp Tomato paste","1.5 tsp Sweet paprika","1 tsp Onion powder","1 tsp Garlic powder","1 tsp salt","1 tsp sugar","1/2 tsp Chili powder","1/2 tsp Freshly ground black pepper","2 Tbsp All-purpose flour","2 cups Whole milk","1.75 cup Beef broth","2 cups Dried whole wheat elbow macaroni","2 cups Shredded cheddar cheese"],1. Brown the ground beef in a large pot until it's no longer pink.  2. Add the onions and cook until they're softened, which should take around 5 minutes.  3. Add the tomato paste, seasonings, flour, and broth to the pot, stirring until they're combined.  4. Pour in the milk and stir to incorporate it into the mixture.  5. Add the macaroni to the pot, bringing it to a boil before reducing it to medium-low heat. Cover the pot and let it simmer for 10-12 minutes, or until the macaroni is cooked to your preferred level of doneness. Check it at 9 minutes for al dente.  6. Once the macaroni is done, remove the pot from the heat and stir in the cheddar cheese until it's fully melted.  7. Serve the dish immediately, optionally garnished with chopped fresh parsley.,2023-02-17T08:48:48.276Z,2023-02-17T08:48:48.276Z
