id,name,image,category,ingredients,instructions,createdAt,updatedAt
65a8262f-8d4e-4621-962a-5ba07875548b,Omurice,null,["Special Dinners"],["10.5 oz chicken","2 tsp shoyu","2 tbsp oil","7 oz onion","21 oz Cooked rice","4 tbsp ketchup","2 tbsp Oyster sauce","Black pepper (to taste)","6 eggs","2 tbsp cream","2 pinch salt","2 tbsp butter"],1. Cut the chicken into bite-sized cubes and place it in a bowl. Pour shoyu over the chicken to marinate for 10-15 minutes.  2. Crack the eggs into a separate bowl, add a pinch of salt and cream, and whisk the mixture together.  3. Heat some oil in a pan over medium heat. Add sliced onions to the pan and sauté until translucent and slightly browned.  4. Increase the heat to medium-high and add the marinated chicken to the pan. Stir-fry the chicken until no raw sides are visible.  5. Add cooked rice to the pan and break any clumps with a spatula. Continue to stir-fry for 2-3 minutes to warm the rice.  6. Pour ketchup and oyster sauce over the rice and chicken mixture. Stir well to coat evenly and cook until the ketchup starts to caramelize, about 3-5 minutes. Add black pepper to taste.  7. Plate the rice mixture in a serving bowl.  8. In a separate pan, make an omelet with the egg mixture from step 2. Once cooked, place the omelet on top of the rice mixture.  9. Serve hot and enjoy!,2023-02-17T08:50:52.415Z,2023-02-17T08:50:52.415Z
cf6d7d76-8154-44f2-ba5f-9165a945a617,Pizza Sauce,null,["Special Dinners"],["2 Tbsp Olive oil","1/3 cup Onion, chopped","3 cloves garlic","3 Tbsp Tomato paste","2 tsp Dried oregano","1 tsp Dried basil","1/2 tsp Garlic powder","1-1/4 tsp salt","1/8 tsp Crushed red pepper","28 oz Canned whole tomatoes","1/2 tsp sugar"],1. Begin by preparing the aromatics: finely chop the onions and smash the garlic cloves.  2. In a small bowl, combine the oregano, basil, garlic powder, salt, and crushed red pepper. Mix thoroughly.  3. Heat oil in a medium-sized pan over medium heat. Once hot, add the chopped onions and sauté for 3-4 minutes until they turn a light brown color.  4. Next, add the minced garlic and all of the spices to the pan. Stir and sauté for 1 minute until the mixture becomes fragrant.  5. Add the tomato paste to the pan and spread it evenly. Allow it to heat up for a few seconds.  6. Pour the canned whole tomatoes into the pan, breaking them up into smaller pieces as much as possible. Let the mixture simmer for about 30 minutes, stirring occasionally.  7. If needed, add sugar to taste.  8. Use the sauce for pizza. This recipe should yield enough sauce for approximately 4 medium-sized pizzas. Store any unused sauce in the refrigerator for up to 3-5 days or in the freezer for up to 3 months.,2023-02-17T08:52:20.350Z,2023-02-17T08:52:20.350Z
8e9e0691-9867-4bb4-868f-60c8c361130d,Best Pizza Ever,null,["Special Dinners"],["16 oz Ball of pizza dough","1 Tbsp Olive oil","1 cup Pizza sauce","3 oz Thinly sliced mozzarella","5 oz Shredded mozzarella","2.5 oz Pepperoni","2 Tbsp Shredded parmesan","1/4 lb Sausage"],1. Follow any prep instructions for you ball of pizza dough. We would highly recommend using a bread machine for this.  2. Cook the sausage in a skillet until it is nearly done. We will finish cooking it in the oven later.  3. Preheat the oven to 400 degrees F  4. Roll out the dough to the desired shape and size of your pizza. Shape the crusts thicker than the middle of the dough. Place pizza on a baking pan.  5. Let the dough rest for 30 minutes.  6. Spread the pizza sauce on the pizza.   7. Add thinly sliced mozzarella to the pizza.  8. Evenly spread the shredded mozzarella on top.  9. Add sausage, pepperoni, and any other toppings on the pizza. You might add onions, mushrooms, olives, bacon.  10. Sprinkle the parmesan on top of everything.  11. Bake for 20 minutes until the toppings look done and crust is golden.,2023-02-17T08:55:13.986Z,2023-02-17T08:55:13.986Z
3c6b43fb-2424-4c2c-86bf-f388743f53cc,Miso Glazed Japanese Eggplant,null,[],["2 tbsp mirin","2 tbsp sake","1/4 cup Shiro miso","1 tbsp sugar","1 tsp Sesame oil","1 pinch salt","4 Japanese eggplant","Vegetable oil (as needed for grilling)","Toasted sesame seeds (for garnish)","2 tbsp chopped green onion (for garnish)"],1. Slice the eggplant into rounds.  2. Place the eggplant rounds in a colander and sprinkle with salt. Let sit for 30 minutes to draw out excess water and reduce bitterness.  3. In a small bowl, mix miso, mirin, and sugar to make a sauce. Set aside.  4. Heat oil in a frying pan over medium heat.  5. Add eggplant and fry until soft and lightly browned on both sides.  6. Reduce heat to low, add the miso sauce to the pan and quickly stir to coat the eggplant evenly.  7. Remove from heat and serve hot as a side dish or over rice.,2023-02-17T08:56:26.815Z,2023-02-17T08:56:26.815Z
0575d4a7-76eb-44f6-8b75-72e1d9767f24,Lion’s mane crab cakes,null,["Special Dinners"],["8 oz Lion mane mushroom","1 egg","1/2 cup panko","1/4 cup Onion (finely diced)","1 tbsp mayo","1 tsp Worcestershire sauce","3/4 tsp paprika","1 tsp Dijon mustard","1 tsp parsley","1/4 tsp salt","1/4 tsp Black pepper","2-3 tsp oil","1/4 cup mayo","1 tbsp relish","1/4 tsp paprika"],1. Shred the mushroom in a bowl.  2. In a large mixing bowl, combine the egg, mayo, onion, Worcestershire sauce, paprika, Dijon mustard, parsley, salt, and pepper. Mix until all ingredients are well incorporated.  3. Add the shredded mushrooms to the bowl and mix well.  4. Stir in the panko breadcrumbs until the mixture is fully combined.  5. Form the mixture into 3-4 patties, making them about ½ to ¾ inch thick.  6. Heat the oil in a frying pan over medium-high heat.  7. Place the patties in the pan and cook for about 2-3 minutes per side, or until they are golden brown and cooked throughout.  8. Serve your delicious mushroom patties hot, and enjoy!,2023-02-17T08:59:45.323Z,2023-02-17T08:59:45.323Z
6ce0fe3a-5edb-4ad9-9e8d-493780fa09de,Roasted Beef Tenderloin with Beer Horseradish Sauce and Pilsner Mushrooms,null,["Special Dinners"],["Beer Horseradish sauce","1/4 cup Pilsner beer","1/4 cup Horseradish, prepared","1/3 cup Sour cream","1/2 tsp Kosher salt","Black pepper","Roasted Beef Tenderloin and Pilsner Mushrooms","2 tbsp Canola oil","3 lb Boneless beef tenderloin","2.5 cup Crimini mushrooms, halved and quartered","1/2 cup Pilsner beer","Olive oil","Salt and pepper to taste"],1. Make the Horseradish Sauce:  * Use a small saucepan, combine the pilsner and horseradish. Bring to a low boil and reduce to a simmer.  * Simmer for 5 minutes so that the alcohol cooks out, and then remove from heat. Let it cool for about 10 minutes.  * In a small bowl, whisk together the beer and horseradish mixture, sour cream, salt and black pepper until smooth and creamy. Transfer to an airtight container and refrigerate until you are ready to serve.  2. Cook the Beef Tenderloin:  * Preheat the oven to 475 F.  * Heat a large cast iron skillet over medium high heat.  * Season the beef tenderloin with salt and pepper.  * Once the pan is hot, add beef to the pan. Sear beef on all sides. Remove beef.  * Lower heat and then add mushrooms. Cook for 4-6 minutes. Season with salt and pepper.  * Add the beer and bring to a low boil. Reduce heat to a simmer and evaporate beer.  * Add the beef back to the pan and place the entire pan into the oven.  * Roast for 45-50 minutes until center is 120-125F for medium rare.  * Remove pan from heat and remove beef from pan. Let the beef rest for 15 minutes, slice as desired.  3. Serve:  * Serve the sliced beef with the mushroom sauce on top or on the side.,2023-02-17T09:01:46.189Z,2023-02-17T09:01:46.189Z